{
 "format": "OpenNAT crédits 1",
 "identifiant": "banc_credits_X16_culture_previsionnel",
 "projet": "X16_culture_previsionnel.projet.json",
 "variante_projet": "Projet",
 "scenario_reference": {
  "defaut": "usage_maintenu",
  "unites": {
   "U0-1": {
    "situation": "usage_maintenu",
    "justification": "culture déclarée à la PAC de 2024 à 2026"
   }
  }
 },
 "obligations": {
  "liste": []
 },
 "releves": [],
 "risque": {
  "maitrise_fonciere": "moyen",
  "financement_gestion": "faible",
  "gestionnaire": "moyen",
  "incendie": "faible",
  "inondation_erosion": "faible",
  "pression_fonciere": "faible",
  "especes_exotiques": "faible",
  "frequentation": "faible"
 },
 "options": {
  "tirages": 0
 }
}